{
  "$schema": "../../../spec/schemas/theme-resolution.schema.json",
  "schema": "neosmartuxui/theme-resolution@1",
  "flavor": "flavor.pulse",
  "theme": "Pulse Light",
  "bundle": "tokens.json",
  "scope": [
    "core.button",
    "core.checkbox",
    "core.input",
    "core.radio",
    "core.switch",
    "core.tabs",
    "core.textarea",
    "core.select",
    "core.card",
    "core.badge",
    "core.alert",
    "core.field",
    "core.breadcrumb",
    "core.pagination",
    "core.segmented-control",
    "core.tooltip",
    "core.combobox",
    "core.accordion",
    "core.label",
    "core.button-group",
    "core.input-group",
    "core.number-field",
    "core.toggle",
    "core.toggle-group",
    "core.slider",
    "core.progress",
    "core.spinner",
    "core.separator",
    "core.input-otp",
    "core.color-picker",
    "core.time-picker",
    "core.multi-select",
    "core.file-upload",
    "core.calendar",
    "core.date-picker",
    "core.dialog",
    "core.alert-dialog",
    "core.drawer",
    "core.popover",
    "core.hover-card",
    "core.dropdown-menu",
    "core.context-menu",
    "core.menubar",
    "core.navigation-menu",
    "core.toast",
    "core.table",
    "core.data-grid",
    "core.item",
    "core.list"
  ]
}
